,search-city,search-key,company,phno,actual-address,actual-tags
22,Mumbai,readymade-garments,"Mens Corner in Malad West, Mumbai",+(91)-9152376039,"Krishna Baug, Shop No 4, Station Road, Malad West, Mumbai - 400064, Near The Mall","Readymade Garment Retailers, Jeans Retailers, .."
23,Mumbai,readymade-garments,"New Mahavir Dresses in Malad West, Mumbai",+(91)-22-28808615,"Shop No 16, Vasanti Bhavan, Station Road, Malad West, Mumbai - 400064, Near Hanuman Mandir","Readymade Garment Retailers, School Uniform Retailers, .."
24,Mumbai,readymade-garments,"My Choice in Kurla West, Mumbai",+(91)-22-25039309,"Shop No 6, Maira Sadan, Sonapur Lane, Kurla West, Mumbai - 400070, Opposite to City Hospital","Readymade Garment Retailers, School Uniform Retailers, .."
25,Mumbai,readymade-garments,"Riya Collection in Kalyan West, Mumbai",+(91)-7021360733,"Shop No 17, Rameshwar Building, Barave Road, Kalyan West, Thane - 421301, Opposite Kailash Park, Kadakpada","Readymade Garment Retailers, Women Kurti Retailers, .."
26,Mumbai,readymade-garments,"Garden Dolly Sarees in Malad West, Mumbai",+(91)-9833010510,"Shop No.8,Maitree Height, Marve Road, Malad West, Mumbai - 400064, Church Plaza Mall","Readymade Garment Retailers, Dress Material Retailers, .."
27,Mumbai,readymade-garments,"Charagh Din in Cuffe Parade-colaba, Mumbai",+(91)-022-61522300,"64 Wodehouse Road, Cuffe Parade-colaba, Mumbai - 400005, Near President Hotel","Readymade Garment Retailers, T Shirt Retailers, .."
28,Mumbai,readymade-garments,"Mansan (Link Square Mall) in Bandra West, Mumbai",+(91)-022-26482954,"S 2 Link Square Mall, Off Linking Road, Bandra West, Mumbai - 400050, Above Croma Electronics","Readymade Garment Retailers, T Shirt Manufacturers, .."
29,Mumbai,readymade-garments,"Patel Emporium in Bhendi Bazar, Mumbai",+(91)-7738268103,"236, Ibrahim Rahimtoola Road, Bhendi Bazar, Mumbai - 400003, Opposite Shalimar Hotel","Readymade Garment Retailers, Men Readymade Garment Retailers, .."
0,Mumbai,readymade-garments,"Aarmish Synergy INC in Mahim, Mumbai",+(91)-9152310247,"Manorama Nagarkar Marg, Mahim, Mumbai - 400016, Opp Allahabad Bank","Readymade Garment Retailers, Readymade Garment Manufacturers, .."
1,Mumbai,readymade-garments,"Cambridge Showroom in Mulund West, Mumbai",+(91)-9152100928,"Damji Kheraj Building, Junction Of R R T Road & Ganesh Gawde Road, Mulund West, Mumbai - 400080, Cambridge Shop","Readymade Garment Retailers, Men Readymade Garment Retailers, .."
2,Mumbai,readymade-garments,"Maheshwari Paithanij in Manor, Mumbai",+(91)-9860011270,"Raice Arced, Shop No 17,Manor 401 and 403, Manor, Palghar - 401403, Near Tdc Bank Manor","Readymade Garment Retailers, Saree Wholesalers, .."
3,Mumbai,readymade-garments,"S Positive The Boutique House in Andheri West, Mumbai",+(91)-7738277112,"Shop No 3A, G Wing, Abhishek Apartment, Juhu Tara Road, Juhu Versova Link Road, Andheri West, Mumbai - 400053, Opposite Abhishek Apartment, Near Balaji Restaurant & Zaf Gym","Readymade Garment Retailers, T Shirt Manufacturers, .."
4,Mumbai,readymade-garments,"S Kumar Tailoring Material in Palghar, Mumbai",+(91)-9152614492,"Ganesh Ashish  Building, Mahim Road, Palghar, Palghar - 401404, Near Dena Bank","Readymade Garment Retailers, Fabric Wholesalers, .."
5,Mumbai,readymade-garments,"Jasmine Annexe in Worli Sea Face, Mumbai",+(91)-9152504318,"261 Malkani Mahal, Dr Annie Beasant Road, Worli Sea Face, Mumbai - 400030, Oppositeb Century Bhavan","Readymade Garment Retailers, Jeans Retailers, .."
6,Mumbai,readymade-garments,"Reliable Designer Studio in Andheri West, Mumbai",+(91)-22-26286045,"Shop No 2, Sujat Mansion, S V Road, Andheri West, Mumbai - 400058, Opposite-Motimahal Restaurant","Readymade Garment Retailers, Shirt Manufacturers, .."
7,Mumbai,readymade-garments,"Jugal Sons in Shanti Nagar-Mira Road, Mumbai",+(91)-9152197138,"B/69, Shop No 9 & 10, Sector No 1, Shanti Nagar-Mira Road, Thane - 401107, Near New India Bank","Readymade Garment Retailers, Turbans On Hire, .."
8,Mumbai,readymade-garments,"Kirti Dress Centre in Dadar East, Mumbai",+(91)-9152346575,"Shop 9/10 Kasam Mitha Building, Naigaon Cross Road, Dadar East, Mumbai - 400014, Near Kailash Lassi Shop and Central Railway Foot Bridge","Readymade Garment Retailers, Saree Wholesalers, .."
9,Mumbai,readymade-garments,"Bottom For Groom in Naupada-thane West, Mumbai",+(91)-9819698585,"Shop No 2, Hem Shopping Centre, Gokhale Road, Naupada-thane West, Thane - 400602, Opposite Mc Donalds","Readymade Garment Retailers, Dress Material Retailers, .."
10,Mumbai,readymade-garments,"Seasons Fashion in Borivali East, Mumbai",+(91)-9967404855,"Shop No 1, Vidya Kunj, Carter Road No 3, Borivali East, Mumbai - 400066, Opposite Ambaji Temple","Readymade Garment Retailers, Tailors, .."
11,Mumbai,readymade-garments,"Bhartiya Khadi Bhandar in Dadar West, Mumbai",+(91)-9152361773,"Shop No 4, Irani Chawl, Senapati Bapat Marg, Dadar West, Mumbai - 400028, Near Dadar Flower Market","Readymade Garment Retailers, Khadi Bhandar Stores, .."
12,Mumbai,readymade-garments,"Shree Nathji Garment in Jogeshwari East, Mumbai",+(91)-9773364553,"Gala No. 114, Desh Udyog, Jogeshwari East, Mumbai - 400060, Behind High Tech Industry, Near Bank Of Baroda","Readymade Garment Retailers, Tailors, .."
13,Mumbai,readymade-garments,"Artisza Men in Dadar East, Mumbai",+(91)-22-24155384,"Shop No 2, Sonu Lunch, Tilak Road, Dadar East, Mumbai - 400014, Near Dadar T T Circle","Readymade Garment Retailers, Fabric Retailers, .."
14,Mumbai,readymade-garments,"Talwars Tiffin in Kopar Khairane, Mumbai",+(91)-7900054413,"1801 A Wing, Shanti Heights, Plot No.2/3/9B, Sector-11,, Kopar Khairane, Navi Mumbai - 400709, Near Shubham Atlantis","Readymade Garment Retailers, Tiffin Services For Monthly Basis, .."
15,Mumbai,readymade-garments,"Deepak Stores in Grant Road, Mumbai",+(91)-22-23072133,"Shop No 5/6/7, Pannalal Terrace, Cross Lane Grant Road, Grant Road, Mumbai - 400007, Near Grant Road Station East","Readymade Garment Retailers, Men Readymade Garment Retailers, .."
16,Mumbai,readymade-garments,"My Choice in Kurla West, Mumbai",+(91)-22-25039309,"Shop No 6, Maira Sadan, Sonapur Lane, Kurla West, Mumbai - 400070, Opposite to City Hospital","Readymade Garment Retailers, School Uniform Retailers, .."
17,Mumbai,readymade-garments,"Riya Collection in Kalyan West, Mumbai",+(91)-7021360733,"Shop No 17, Rameshwar Building, Barave Road, Kalyan West, Thane - 421301, Opposite Kailash Park, Kadakpada","Readymade Garment Retailers, Women Kurti Retailers, .."
18,Mumbai,readymade-garments,"Preyasi in Andheri West, Mumbai",+(91)-22-26241003,"Shop No-1/C Alankar Shopping Centre, S V Road, Andheri West, Mumbai - 400058, Near Nadco","Readymade Garment Retailers, Dress Material Retailers, .."
19,Mumbai,readymade-garments,"Dev Collection in Lower Parel, Mumbai",+(91)-9892288068,"Shop No. 2/298, Ganpatrao Kadam Marg, Lower Parel, Mumbai - 400013, Near A to Z Industrial Estate","Readymade Garment Retailers, Jeans Retailers, .."
0,Mumbai,readymade-garments,"Seasons Fashion in Borivali East, Mumbai",+(91)-9967404855,"Shop No 1, Vidya Kunj, Carter Road No 3, Borivali East, Mumbai - 400066, Opposite Ambaji Temple","Readymade Garment Retailers, Tailors, .."
1,Mumbai,readymade-garments,"First Choice Collection in Jogeshwari, Mumbai",+(91)-9152501288,"Shop. No. A. 16.   BMC.  Colony, Anand. Nagar, Jogeshwari, Mumbai - 400060, MegaMall","Readymade Garment Retailers, Children Readymade Garment Retailers, .."
2,Mumbai,readymade-garments,"Prom Girl in Dadar West, Mumbai",+(91)-9152272008,"Shop No 1 & 2, Shanti Plaza, Garage Galli, Dadar West, Mumbai - 400028, opposite Atlantic Plaza","Readymade Garment Retailers, Ladies Readymade Garment Wholesalers, .."
3,Mumbai,readymade-garments,"Bollywood Trends in Andheri West, Mumbai",+(91)-9920787375,"A 604 Areana Apartment, Lokhandwala Market Road, Andheri West, Mumbai - 400058, Opposite Celebration Sports Club","Readymade Garment Retailers, Boutiques, .."
4,Mumbai,readymade-garments,"Talwars Tiffin in Kopar Khairane, Mumbai",+(91)-7900054413,"1801 A Wing, Shanti Heights, Plot No.2/3/9B, Sector-11,, Kopar Khairane, Navi Mumbai - 400709, Near Shubham Atlantis","Readymade Garment Retailers, Tiffin Services For Monthly Basis, .."
5,Mumbai,readymade-garments,"Deepak Stores in Grant Road, Mumbai",+(91)-22-23072133,"Shop No 5/6/7, Pannalal Terrace, Cross Lane Grant Road, Grant Road, Mumbai - 400007, Near Grant Road Station East","Readymade Garment Retailers, Men Readymade Garment Retailers, .."
6,Mumbai,readymade-garments,"The Brand Gallery and Fabric in Nerul, Mumbai",+(91)-8108464363,"Shop No 3/ 4, Trimurtii Building, Sector-28, Nerul, Navi Mumbai - 400706, Near Talav","Readymade Garment Retailers, Jeans Retailers, .."
7,Mumbai,readymade-garments,"Oxemberg in Kopar Khairane, Mumbai",+(91)-8605040160,"Shop No-2, Silvernest  Co-Operative Housing Society Pvt Ltd, Sector -15, Kopar Khairane, Navi Mumbai - 400709, Near Gulab Dairy","Readymade Garment Retailers, Jeans Retailers, .."
8,Mumbai,readymade-garments,"Lady World in Kandivali East, Mumbai",+(91)-9870067800,"Shop No 28, Viceroy Court, Thakul Village, Kandivali East, Mumbai - 400101, Opposite Dominos Pizza","Readymade Garment Retailers, Women Boutiques, .."
9,Mumbai,readymade-garments,"Vibgyor Boutique in Vashi Sector 29, Mumbai",+(91)-22-27899270,"Shop No 07, Om Shiv Paravati Co Operative Housing Society, Plot No 101, Vashi Sector 29, Navi Mumbai - 400703, Near Rajeev Gandhi Udyan, Sector 29","Readymade Garment Retailers, Tailors For Women, .."
0,Mumbai,readymade-garments,"Deepak Stores in Grant Road, Mumbai",+(91)-22-23072133,"Shop No 5/6/7, Pannalal Terrace, Cross Lane Grant Road, Grant Road, Mumbai - 400007, Near Grant Road Station East","Readymade Garment Retailers, Men Readymade Garment Retailers, .."
1,Mumbai,readymade-garments,"Cambridge Showroom in Dahanu, Mumbai",+(91)-02528-224945,"Ground Floor, Indraprastha Building, Dahanu, Palghar - 401601, Near Bank Of Baroda","Readymade Garment Retailers, Blazer Retailers, .."
2,Mumbai,readymade-garments,"Cambridge Showroom in Mazgaon, Mumbai",+(91)-022-23770095,"Baliwala, Mazgaon, Mumbai - 400010, Opposite Konkan Mercantile Bank","Readymade Garment Retailers, Jeans Retailers, .."
3,Mumbai,readymade-garments,"Pooja Stores in Vile Parle East, Mumbai",+(91)-9769666412,"Shop No 2/3, Plot No 75, Patel House, M G Road, Vile Parle East, Mumbai - 400057, Near Bank Of Baroda","Readymade Garment Retailers, Undergarment Retailers, .."
4,Mumbai,readymade-garments,"Preyasi in Andheri West, Mumbai",+(91)-22-26241003,"Shop No-1/C Alankar Shopping Centre, S V Road, Andheri West, Mumbai - 400058, Near Nadco","Readymade Garment Retailers, Dress Material Retailers, .."
5,Mumbai,readymade-garments,"Cambridge Showroom in Malad West, Mumbai",+(91)-022-28823171,"12 A/14 Patel Shopping Centre, Sainath Road, Malad West, Mumbai - 400064, Opposite Malad Subway","Readymade Garment Retailers, Jeans Retailers, .."
6,Mumbai,readymade-garments,"Savi in Thane West, Mumbai",+(91)-22-25396868,"Shop No 2, Vinayak Sadan, Gokhale Road, Thane West, Thane - 400602, Naupada","Readymade Garment Retailers, Dress Material Retailers, .."
7,Mumbai,readymade-garments,"Talwars Tiffin in Kopar Khairane, Mumbai",+(91)-7900054413,"1801 A Wing, Shanti Heights, Plot No.2/3/9B, Sector-11,, Kopar Khairane, Navi Mumbai - 400709, Near Shubham Atlantis","Readymade Garment Retailers, Tiffin Services For Monthly Basis, .."
8,Mumbai,readymade-garments,"Cambridge Showroom in Panvel City, Mumbai",+(91)-22-27464883,"Shop No 1, Virupaksh Plaza, Shivaji Road, Panvel City, Navi Mumbai - 410206","Readymade Garment Retailers, Jeans Retailers, .."
9,Mumbai,readymade-garments,"Dev Collection in Lower Parel, Mumbai",+(91)-9892288068,"Shop No. 2/298, Ganpatrao Kadam Marg, Lower Parel, Mumbai - 400013, Near A to Z Industrial Estate","Readymade Garment Retailers, Jeans Retailers, .."
0,Mumbai,readymade-garments,"Cambridge Showroom in Kalyan West, Mumbai",+(91)-0251-2207373,"Shop No 3, Shubhlaxmi Shopping Centre, Agra Road, Kalyan West, Thane - 421301, Shivaji Chowk","Readymade Garment Retailers, Jeans Retailers, .."
1,Mumbai,readymade-garments,"Lady World in Kandivali East, Mumbai",+(91)-9870067800,"Shop No 28, Viceroy Court, Thakul Village, Kandivali East, Mumbai - 400101, Opposite Dominos Pizza","Readymade Garment Retailers, Women Boutiques, .."
2,Mumbai,readymade-garments,"Cambridge Showroom in Dombivli East, Mumbai",+(91)-0251-2862511,"Mukund Apartment, Manpada Road, Dombivli East, Thane - 421201, Opposite Bank Of Baroda","Readymade Garment Retailers, Jeans Retailers, .."
3,Mumbai,readymade-garments,"Jockey Exclusive Store in Kharghar, Mumbai",+(91)-9967569642,"Shop 10 Carina Building, Sector 15, Kharghar, Navi Mumbai - 410210, Dmart","Readymade Garment Retailers, Children Readymade Garment Retailers, .."
4,Mumbai,readymade-garments,"Rii Creation in , Mumbai",+(91)-8879226945,"16/18, Krishna Nivas, Ground Floor, Shop No 1, Champa Galli Cross Lane, MUMBAI - 400002","Readymade Garment Retailers, T Shirt Manufacturers, .."
5,Mumbai,readymade-garments,"Perfect Apparels in Andheri West, Mumbai",+(91)-9768423340,"Sagar City, Gaodevi Dongri Cama Road, Andheri West, Mumbai - 400058, Near Wahid Lala Garage","Readymade Garment Retailers, Cotton Trouser Manufacturers, .."
6,Mumbai,readymade-garments,"Avani Collection in Dahisar, Mumbai",+(91)-22-28282421,"Shop No 2 Parshwa Giriraj Building, Harishankar Joshi Road, Dahisar, Mumbai - 400068, Opposite Madhuram Hall &  Near Bombay Cutpiece, Opposite Dahisar Railway Station","Readymade Garment Retailers, Women Kurti Wholesalers, .."
7,Mumbai,readymade-garments,"Cambridge Showroom in Andheri West, Mumbai",+(91)-22-26288409,"14, Laram Centre, S V Road, Andheri West, Mumbai - 400058, Behind Aditi Restaurant","Readymade Garment Retailers, Jeans Retailers, .."
8,Mumbai,readymade-garments,"Cambridge Showroom in Bhiwandi, Mumbai",+(91)-9769857607,"Mahavir Society, Dhanakar Naka, Bhiwandi, Thane - 421308, Near Payal Talkies","Readymade Garment Retailers, Jeans Retailers, .."
9,Mumbai,readymade-garments,"Cambridge Showroom in Bhandup West, Mumbai",+(91)-22-25947988,"Shop No 5-A, Bama Smruti, Station Road, Bhandup West, Mumbai - 400078, Opp Dream Mall,Near Gurunanak School","Readymade Garment Retailers, Jeans Retailers, .."
0,Mumbai,readymade-garments,"Cambridge Showroom in Naupada-Thane West, Mumbai",+(91)-22-25381927,"Matru Smruti Building, Mahatma Phule Road, Naupada-Thane West, Thane - 400602, Near Parsik Janta Bank","Readymade Garment Retailers, Jeans Retailers, .."
1,Mumbai,readymade-garments,"Ansari Tailors in Jogeshwari West, Mumbai",+(91)-9987652347,"Shop No 16 Danjal Chawl, Link Road, Jogeshwari West, Mumbai - 400102, Near Bahram Baug Police Station","Readymade Garment Retailers, Saree Retailers, .."
2,Mumbai,readymade-garments,"Cambridge Showroom in Bhandup West, Mumbai",+(91)-22-25947988,"Shop No 5-A, Bama Smruti, Station Road, Bhandup West, Mumbai - 400078, Opp Dream Mall,Near Gurunanak School","Readymade Garment Retailers, Jeans Retailers, .."
3,Mumbai,readymade-garments,"Cambridge Showroom in Andheri West, Mumbai",+(91)-22-26288409,"14, Laram Centre, S V Road, Andheri West, Mumbai - 400058, Behind Aditi Restaurant","Readymade Garment Retailers, Jeans Retailers, .."
4,Mumbai,readymade-garments,"Revved Jeans in Kurla West, Mumbai",+(91)-9833272764,"Gala No 8, Naseebullah Compound Gali No.2 Shop  No. 8, Kurla West, Mumbai - 400070, Near Kalpana Cinema","Readymade Garment Retailers, Women Kurti Wholesalers, .."
5,Mumbai,readymade-garments,"My Choice in Kurla West, Mumbai",+(91)-22-25039309,"Shop No 6, Maira Sadan, Sonapur Lane, Kurla West, Mumbai - 400070, Opposite to City Hospital","Readymade Garment Retailers, School Uniform Retailers, .."
6,Mumbai,readymade-garments,"Riya Collection in Kalyan West, Mumbai",+(91)-7021360733,"Shop No 17, Rameshwar Building, Barave Road, Kalyan West, Thane - 421301, Opposite Kailash Park, Kadakpada","Readymade Garment Retailers, Women Kurti Retailers, .."
7,Mumbai,readymade-garments,"Cambridge Showroom in Dadar West, Mumbai",+(91)-22-24329789,"Shop No 3 & 4 C Wing Swati Mano, J K Sawant Marg, Dadar West, Mumbai - 400028, Near Plaza Cinema","Readymade Garment Retailers, Men Readymade Garment Retailers, .."
8,Mumbai,readymade-garments,"Cambridge Showroom in Goregaon West, Mumbai",+(91)-22-28773254,"Shop 6 & 7, Gusting Building, S V Road, Goregaon West, Mumbai - 400062, Near Vijay Sales","Readymade Garment Retailers, Jeans Retailers, .."
9,Mumbai,readymade-garments,"Retail Mills Cloth Stores in Parel, Mumbai",+(91)-22-24149042,"Shop No 1, Mistry Building, Ram Niwas, Jerbai Wadia Road, Parel, Mumbai - 400012, Near Tata Hospital","Readymade Garment Retailers, Readymade Garment Manufacturers, .."
0,Mumbai,readymade-garments,"Oxemberg in Kopar Khairane, Mumbai",+(91)-8605040160,"Shop No-2, Silvernest  Co-Operative Housing Society Pvt Ltd, Sector -15, Kopar Khairane, Navi Mumbai - 400709, Near Gulab Dairy","Readymade Garment Retailers, Jeans Retailers, .."
1,Mumbai,readymade-garments,"Cambridge Showroom in Naupada-Thane West, Mumbai",+(91)-22-25381927,"Matru Smruti Building, Mahatma Phule Road, Naupada-Thane West, Thane - 400602, Near Parsik Janta Bank","Readymade Garment Retailers, Jeans Retailers, .."
2,Mumbai,readymade-garments,"Ansari Tailors in Jogeshwari West, Mumbai",+(91)-9987652347,"Shop No 16 Danjal Chawl, Link Road, Jogeshwari West, Mumbai - 400102, Near Bahram Baug Police Station","Readymade Garment Retailers, Saree Retailers, .."
3,Mumbai,readymade-garments,"Cambridge Showroom in Kurla West, Mumbai",+(91)-22-26503390,"Station Road, Kurla West, Mumbai - 400070, Opposite Bharat Cinema","Readymade Garment Retailers, Jeans Retailers, .."
4,Mumbai,readymade-garments,"Revved Jeans in Kurla West, Mumbai",+(91)-9833272764,"Gala No 8, Naseebullah Compound Gali No.2 Shop  No. 8, Kurla West, Mumbai - 400070, Near Kalpana Cinema","Readymade Garment Retailers, Women Kurti Wholesalers, .."
5,Mumbai,readymade-garments,"Elegant Ladies Beauty Parlour & Health Clinic in Nerul, Mumbai",+(91)-9930688390,"Shop  No-03, Shiv Kripa Apartment , Plot No. B-80, Sector 23, Nerul, Navi Mumbai - 400706, Near Seawoods Station","Beauty Spas, Salons, .."
6,Mumbai,readymade-garments,"Vibgyor Boutique in Vashi Sector 29, Mumbai",+(91)-22-27899270,"Shop No 07, Om Shiv Paravati Co Operative Housing Society, Plot No 101, Vashi Sector 29, Navi Mumbai - 400703, Near Rajeev Gandhi Udyan, Sector 29","Readymade Garment Retailers, Tailors For Women, .."
7,Mumbai,readymade-garments,"Cambridge Showroom in Ghatkopar West, Mumbai",+(91)-022-25116651,"Shop No 19/20, Laxmi Shopping Centre, H D Road, Ghatkopar West, Mumbai - 400086, Near New Post Office,Near Railway Station","Readymade Garment Retailers, Jeans Retailers, .."
8,Mumbai,readymade-garments,"Amarsons Collection in Bandra West, Mumbai",+(91)-8104417557,"Shop No 269, Linking Road, Bandra West, Mumbai - 400050, Opposite Petrol Pump","Jewellery Showrooms, Readymade Garment Retailers, .."
9,Mumbai,readymade-garments,"Fashion Street in Marine Lines, Mumbai",+(91)-9320647000,"Mahatma Gandhi Road, Marine Lines, Mumbai - 400020","Readymade Garment Retailers, Men Waist Belt Wholesalers, .."
0,Mumbai,readymade-garments,"Hypercity Retail INDIA Ltd in Malad West, Mumbai",+(91)-022-40695555,"New Link Road, Malad West, Mumbai - 400064, Next to Inorbit Mall, Mindspace","Mobile Phone Dealers, Readymade Garment Retailers, .."
1,Mumbai,readymade-garments,"D Mart in Nirmal Nagar-mulund West, Mumbai",+(91)-022-30918200,"Mulund Goregaon Link Road, Nirmal Nagar-mulund West, Mumbai - 400080, Near Krishna Motors Opposite Fortis Hospital","Readymade Garment Retailers, Departmental Stores, .."
2,Mumbai,readymade-garments,"D Mart in Powai, Mumbai",+(91)-22-30963700,"Ground Floor, Spectra Building, Powai, Mumbai - 400076, Hiranandini Garden, Near Haikco Super Market High Street Corner","Readymade Garment Retailers, Departmental Stores, .."
3,Mumbai,readymade-garments,"D Mart in Malad West, Mumbai",+(91)-022-40900100,"Palm Court Complex, Link Road, Malad West, Mumbai - 400064, Next to Croma Store","Readymade Garment Retailers, Departmental Stores, .."
4,Mumbai,readymade-garments,"D Mart in Kopar Khairane Sector 7, Mumbai",+(91)-22-33400500,"Plot No 105, Kopar Khairane Sector 7, Navi Mumbai - 400709, Naik Circle","Supermarkets, Departmental Stores, .."
5,Mumbai,readymade-garments,"D Mart in Seawoods, Mumbai",+(91)-022-27709357,"Plot No 1, Seawoods, Navi Mumbai - 400706, Near Kendri Vihar, Sector 38","Readymade Garment Retailers, Departmental Stores, .."
6,Mumbai,readymade-garments,"D Mart in New Panvel, Mumbai",+(91)-022-33400500,"Plot No.42/45, New Panvel, Navi Mumbai - 410221, Near Railway Crossing,Opposite Prajapati Garden, Sector No 5","Supermarkets, Departmental Stores, .."
7,Mumbai,readymade-garments,"Big Bazaar (Growels 101 Mall) in Kandivali East, Mumbai",+(91)-022-39432331,"101, Growels Mall, Akurli Road, Kandivali East, Mumbai - 400101, Near Off Western Express Highway","Mobile Phone Dealers, Supermarkets, .."
8,Mumbai,readymade-garments,"D Mart in Dombivli East, Mumbai",+(91)-8291098417,"Manpada Road, Dombivli East, Thane - 421201, Bhopar, Near Shani Mandir","Supermarkets, Departmental Stores, .."
9,Mumbai,readymade-garments,"D Mart in Kharghar, Mumbai",+(91)-22-33400500,"Plot No 12 & 13, Kharghar, Navi Mumbai - 410210, Near Gharkool, Sector 15","Supermarkets, Readymade Garment Retailers, .."
0,Mumbai,readymade-garments,"D Mart in Airoli, Mumbai",+(91)-022-27642939,"Plot No 6, Airoli, Navi Mumbai - 400708, Near HP Gas Depot, Sector 10/A","Supermarkets, Departmental Stores, .."
1,Mumbai,readymade-garments,"D Mart in Mira Road, Mumbai",+(91)-022-33400500,"Serial No 141, Hissa No 2, Navghar Kashimira Road, Mira Road, Thane - 401107, Near Hatkesh, Opposite Dominos","Mobile Phone Dealers, Readymade Garment Retailers, .."
2,Mumbai,readymade-garments,"D Mart in Dahisar, Mumbai",+(91)-022-28955200,"Laxman Tower, New Link Road, Dahisar, Mumbai - 400068, Near Kander Pada","Readymade Garment Retailers, Departmental Stores, .."
3,Mumbai,readymade-garments,"D Mart in Mahavir Nagar-kandivali West, Mumbai",+(91)-022-33400500,"V Souk Mall, 90 Feet Road, Mahavir Nagar-kandivali West, Mumbai - 400067, Near Croma Store & Kamla Vihar Club","Supermarkets, Departmental Stores, .."
4,Mumbai,readymade-garments,"Shoppers Stop in Bandra West, Mumbai",+(91)-022-42492100,"1st Floor, Suburbia Mall, Linking Road, Bandra West, Mumbai - 400050, Next to Great Punjab Restaurant","Jewellery Showrooms, Furniture Dealers, .."
5,Mumbai,readymade-garments,"D Mart in Gegaon, Mumbai",+(91)-02527-3050300,"Avenue Supermart Ltd, Bail Bazar Road, Gegaon, Thane - 421403, Opposite Joker Cinema & K C Gandhi School , Shivaji Chowk","Supermarkets, Departmental Stores, .."
6,Mumbai,readymade-garments,"T H Computer Repair and Service  in Andheri West, Mumbai",+(91)-022-40746000,"Building No 211 D, SV Road, Andheri West, Mumbai - 400058, Next to Citi Bank, Near Radha Krishna Hotel","Readymade Garment Retailers, Departmental Stores, .."
7,Mumbai,readymade-garments,"D Mart in Thakur Village-kandivali East, Mumbai",+(91)-22-28463658,"Narmada Mall, Vasant Sagar Complex, Thakur Village-kandivali East, Mumbai - 400101, Near Thakur College","Readymade Garment Retailers, Departmental Stores, .."
8,Mumbai,readymade-garments,"D Mart in Versova, Mumbai",+(91)-22-30963600,"Yari Road, Versova, Mumbai - 400061, Opposite Kabarastan, Everest Tower,","Readymade Garment Retailers, Departmental Stores, .."
9,Mumbai,readymade-garments,"Big Bazaar in Matunga West, Mumbai",+(91)-022-49268111,"Ground Floor, New Era House, Mogul Lane, Matunga West, Mumbai - 400016, Near Ganga Vihar Hotel","Electronic Goods Showrooms, Supermarkets, .."
0,Mumbai,readymade-garments,"D Mart in Vasai West, Mumbai",+(91)-0250-6634200,"Papdi Road, Vasai West, Palghar - 401202, Near Babhola Naka, Near Police Chowki, Opposite Vagmare Clinic","Mobile Phone Dealers, Readymade Garment Retailers, .."
1,Mumbai,readymade-garments,"D Mart in Kasarvadavali, Mumbai",+(91)-22-25974517,"Ghodbunder Road, Kasarvadavali, Thane - 400615, Vijay  Garden, Near Suraj Water Park, Next to Kavesar Village","Readymade Garment Retailers, Departmental Stores, .."
2,Mumbai,readymade-garments,"Reliance Smart (Acme Mall) in Khira Nagar-santacruz West, Mumbai",+(91)-022-26600263,"Acme Mall, S V Road, Khira Nagar-santacruz West, Mumbai - 400054, Near Milan Subway","Supermarkets, Readymade Garment Retailers, .."
3,Mumbai,readymade-garments,"D Mart in Bhayandar West, Mumbai",+(91)-22-28172672,"90 Feet Road, Bhayandar West, Thane - 401101, Opposite Maxus Mall","Chemists, Supermarkets, .."
4,Mumbai,readymade-garments,"Shoppers Stop (Inorbit Mall) in Malad West, Mumbai",+(91)-022-42492500,"Plot No 1406/A,28/A Inorbit Mall, New Link Road, Malad West, Mumbai - 400064, Near Hypercity","Readymade Garment Retailers, Sports Goods Dealers, .."
5,Mumbai,readymade-garments,"Pantaloons in Borivali West, Mumbai",+(91)-022-28334770,"Sri Vallabh Shopping Centre, S V Road, Borivali West, Mumbai - 400092, Opposite Gokul Shopping Centre, Near Flyover","Jewellery Showrooms, Cosmetic Dealers, .."
6,Mumbai,readymade-garments,"Brand Factory in Kashimira-mira Road, Mumbai",+(91)-022-65644600,"Space 912 Pleasant Park Mira Road East, Kashimira-mira Road, Thane - 401107, Opposite Mira-Bhayandher Road","Readymade Garment Retailers, Ladies Readymade Garment Retailers, .."
7,Mumbai,readymade-garments,"Brand Factory (Sobo Central Mall) in Tardeo, Mumbai",+(91)-22-30008232,"Sobo Central Mall, Cross Road, Tardeo, Mumbai - 400034, Near Haji Ali & Heera Panna Shopping Centre","Readymade Garment Retailers, Children Readymade Garment Retailers, .."
8,Mumbai,readymade-garments,"Brand Factory in Mahavir Nagar-kandivali West, Mumbai",+(91)-022-28650003,"Mahavir Nagar-kandivali West, Mumbai - 400067, Near V Chowk, Sector 10, Opposite Kamla Sports Club","Readymade Garment Retailers, Ladies Readymade Garment Retailers, .."
