,search-city,search-key,company,phno,actual-address,actual-tags
4,Mumbai,readymade-garments,"The Raymond Shop in Dadar East, Mumbai",+(91)-022-24124425,"88, 806, Empire Mahal, Dr Ambedkar Road, Dadar East, Mumbai - 400014, Near Dadar T T Circle","Readymade Garment Retailers, Jeans Retailers, .."
5,Mumbai,readymade-garments,"City Girl Lifestyle Pvt Ltd in Lokhandwala Complex-andheri West, Mumbai",+(91)-22-26326406,"Shop No. 7 to 12, Benzer Co-Operative Housing Society Limited, Main Market Road, Lokhandwala Complex-andheri West, Mumbai - 400053","Readymade Garment Retailers, Children Readymade Garment Retailers, .."
6,Mumbai,readymade-garments,"Deluxe Collection in Kurla East, Mumbai",+(91)-22-25277866,"Shop No.936, Nehru Nagar, S G Barve Marg, Kurla East, Mumbai - 400024, Opp, Kurla Station","Costumes On Hire, Tailors, .."
7,Mumbai,readymade-garments,"Cottons Jaipur in Bandra West, Mumbai",+(91)-22-26400313,"Alexandra, St Sebastian Road,, Bandra West, Mumbai - 400050, Behind Lilawati Hospital","Readymade Garment Retailers, Ladies Readymade Garment Retailers, .."
8,Mumbai,readymade-garments,"Woodland Store in Sakinaka, Mumbai",+(91)-22-28575032,"H Kantilal Compound, Andheri Kurla Road, Sakinaka, Mumbai - 400072","Readymade Garment Retailers, T Shirt Retailers, .."
9,Mumbai,readymade-garments,"Aishwarya Design Studio Pvt Ltd in Vile Parle West, Mumbai",+(91)-22-26284545,"Ruby House, Irla Society Road, Vile Parle West, Mumbai - 400056, Near Alfa No 3","Readymade Garment Retailers, Dress Material Retailers, .."
0,Mumbai,readymade-garments,"Woodland Store (Lake City Mall) in Thane West, Mumbai",+(91)-22-25441968,"Shop No Ga 1, Lake City Mall, Ground Floor, Ghodbunder Road, Thane West, Thane - 400601, Near Big Bazaar, Kapurbawdi Junction","Readymade Garment Retailers, T Shirt Retailers, .."
1,Mumbai,readymade-garments,"Queens Emporium in Marine Lines, Mumbai",+(91)-022-22005461,"89, Queens Chambers, M K Marg, Marine Lines, Mumbai - 400020, Near Royal Chemist","Readymade Garment Retailers, Saree Wholesalers, .."
2,Mumbai,readymade-garments,"Options The Fashion Mall in Lokhandwala Complex-andheri West, Mumbai",+(91)-022-67249999,"9, Raheja Classic, Lokhandwala Complex-andheri West, Mumbai - 400053, Near Infiniti Mall,  Off Link Road","Readymade Garment Retailers, Men Readymade Garment Retailers, .."
3,Mumbai,readymade-garments,"Ensemble in Fountain, Mumbai",+(91)-022-40564800,"130/132, Great Western Building, Shahid Bhagat Singh Road, Fountain, Mumbai - 400001, Kala Ghoda, Opposite Lion Gate","Readymade Garment Retailers, Boutiques, .."
4,Mumbai,readymade-garments,"Louis Philippe in Lower Parel, Mumbai",+(91)-22-66172045,"Shop No 2, Skyzone , High Street Phoenix, Senapati Bapat Marg, Lower Parel, Mumbai - 400013","Readymade Garment Retailers, T Shirt Retailers, .."
5,Mumbai,readymade-garments,"Telon in Kemps Corner, Mumbai",+(91)-22-23675554,"149, Doctor Building, Warden Road, Kemps Corner, Mumbai - 400006, Next to Shalimar Hotel, Opposite Gangar Optics","Readymade Garment Retailers, Readymade Garment Manufacturers, .."
6,Mumbai,readymade-garments,"Sheetal INDIA in Grant Road, Mumbai",+(91)-22-23856565,"Sheetal Estate, Maulana Shaukat Ali Road, Grant Road, Mumbai - 400007, Opposite Novelty Cinema","Readymade Garment Retailers, Fabric Retailers, .."
7,Mumbai,readymade-garments,"Vandana Fabrics in Nepean Sea Road, Mumbai",+(91)-22-23692340,"Shop No 1 & 10, Chandralok A-97, Napean Sea Road, Nepean Sea Road, Mumbai - 400006, Near Kamdhenu Store, Last Bus Stop","Readymade Garment Retailers, Ladies Readymade Garment Retailers, .."
8,Mumbai,readymade-garments,"Fabindia (Infiniti Mall) in Malad West, Mumbai",+(91)-022-42950787,"Store No 125, 1st Floor, Infiniti Mall, Link Road, Malad West, Mumbai - 400064, Next to Goregaon Sports Complex","Readymade Garment Retailers, Online Websites, .."
9,Mumbai,readymade-garments,"Pagli in Borivali West, Mumbai",+(91)-22-28953900,"2, Landmark Building, S V Road, Borivali West, Mumbai - 400092, Near Ganjawala Petrol Pump & Station Bus Depot,","Readymade Garment Retailers, Children Readymade Garment Retailers, .."
0,Mumbai,readymade-garments,"Puma Store in Colaba, Mumbai",+(91)-022-22852282,"Shop No 73, Apsara Building, Shahid Bhagatsingh Road, Colaba, Mumbai - 400005, Opposite Electric House, Colaba Causeway","Readymade Garment Retailers, Wrist Watch Dealers, .."
1,Mumbai,readymade-garments,"All The Plus Size Store in Breach Candy, Mumbai",+(91)-22-23525674,"Shop No 43, Krishnabad Building, Bhulabhai Desai Road, Breach Candy, Mumbai - 400026, Opposite Akruti Sky Park","Readymade Garment Retailers, Men Readymade Garment Retailers, .."
2,Mumbai,readymade-garments,"Janta Bazar in Vasai West, Mumbai",+(91)-0250-2331644,"Shop No. 6, Arihant Co-Operative Society, Station Road, Vasai West, Palghar - 401202, Near Navghar Nagarpalika","Readymade Garment Retailers, Ladies Readymade Garment Retailers, .."
3,Mumbai,readymade-garments,"United Colors Of Benetton in Santacruz West, Mumbai",+(91)-22-66970072,"Ground Floor, Raheja Chambers, Linking Road, Santacruz West, Mumbai - 400054, Near Main Avenue Crossing, Near Aarya Samaj Mandir","Readymade Garment Retailers, Ladies Readymade Garment Retailers, .."
4,Mumbai,readymade-garments,"Trends in Bhiwandi, Mumbai",18001027382,"Konark Arcade, Agra Road, Bhiwandi, Thane - 421308, Dominos Pizza Corner, St Bus Depot","Readymade Garment Retailers, Children Readymade Garment Retailers, .."
5,Mumbai,readymade-garments,"X Factor House Of Fashion For Him in Saibaba Nagar-Borivali West, Mumbai",+(91)-022-28635254,"Shop.No-D/2/5, Geetanjali Apt, Sai Baba Nagar, Saibaba Nagar-Borivali West, Mumbai - 400092, Opp-Bank Of Baroda","Readymade Garment Retailers, Jeans Retailers, .."
6,Mumbai,readymade-garments,"Vero Moda (Infiniti Mall) in Andheri West, Mumbai",+(91)-22-66990600,"Shop No 1021, Ground Floor, Infiniti Mall, New Link Road, Andheri West, Mumbai - 400053, Near Fame Adlabs Cinema, Near Raheja Classic Complex","Readymade Garment Retailers, Jeans Retailers, .."
7,Mumbai,readymade-garments,"The Raymond Shop (Oberoi Mall) in Goregaon East, Mumbai",+(91)-22-49728161,"Unit No F 10 & 11, 1st Floor, Oberoi Mall, General A K Vaidya Marg, Goregaon East, Mumbai - 400063, Off Western Express Highway","Readymade Garment Retailers, Blazer Retailers, .."
8,Mumbai,readymade-garments,"Fabindia in Andheri West, Mumbai",+(91)-22-65517111,"Unit No 2, De Mall, New Chandra Co-operative Housing Society, Veera Desai Road, Andheri West, Mumbai - 400058, Near Shah Industrial Estate, Scoda Showroom","Readymade Garment Retailers, Ladies Readymade Garment Retailers, .."
9,Mumbai,readymade-garments,"Cotton Planet in Malad West, Mumbai",+(91)-022-28825722,"Ruturaj Apartment, Liberty Garden Road No 3, Malad West, Mumbai - 400064, Near Nana Shankar Seth Chowk, Near ICICI Bamk","Readymade Garment Retailers, Children Readymade Garment Retailers, .."
0,Mumbai,readymade-garments,"Fashion At Big Bazaar (Star Mall) in Dadar West, Mumbai",+(91)-022-24325489,"Star Mall, N C Kelkar Road, Dadar West, Mumbai - 400028","Readymade Garment Retailers, Ladies Readymade Garment Retailers, .."
1,Mumbai,readymade-garments,"The Raymond Shop in Mira Road, Mumbai",+(91)-22-28131610,"Mira Bhayandar Main Road, Mira Road, Thane - 401107, Near Old Petrol Pump","Readymade Garment Retailers, Men Readymade Garment Retailers, .."
2,Mumbai,readymade-garments,"Memsaab Designer Wear in Vashi, Mumbai",+(91)-022-27811613,"Shop No. 31 to 34, Ground Floor, Real Tech Park, Vashi, Navi Mumbai - 400703, Next to Central  Mall, Opposite Railway Station","Readymade Garment Retailers, Ladies Readymade Garment Retailers, .."
3,Mumbai,readymade-garments,"Nike Store in Borivali West, Mumbai",+(91)-22-28997905,"Shop No 36, Satra Park, Shimpoli Road, Borivali West, Mumbai - 400092, Near Reliance Shopping Mall","Readymade Garment Retailers, Wrist Watch Dealers, .."
4,Mumbai,readymade-garments,"Cottonworld in Andheri West, Mumbai",+(91)-022-26392368,"Laxmi Plaza, Andheri West, Mumbai - 400053, Off New Link Road","Readymade Garment Retailers, Men Readymade Garment Retailers, .."
5,Mumbai,readymade-garments,"Muji (Palladium Mall) in Lower Parel, Mumbai",+(91)-22-24981911,"Palladium Mall, Shop No T/1A, 3rd Floor, Lower Parel, Mumbai - 400013, High Street Phoenix","Readymade Garment Retailers, Ladies Readymade Garment Retailers, .."
6,Mumbai,readymade-garments,"Tommy Hilfiger (Palladium Mall) in Lower Parel, Mumbai",+(91)-22-66108880,"Shop No. S8, 2nd Floor, Palladium Mall, S B Marg No. 462, Lower Parel, Mumbai - 400013, Near Pheonix Mills","Readymade Garment Retailers, Wrist Watch Dealers, .."
7,Mumbai,readymade-garments,"Sagar Garments in Bandra West, Mumbai",+(91)-22-26429999,"Shop No 1, B, Khimji Arcade, 39 Hill Road, Bandra West, Mumbai - 400050, Opposite Elco Market","Readymade Garment Retailers, Children Readymade Garment Retailers, .."
8,Mumbai,readymade-garments,"Reebok Store in Lower Parel, Mumbai",+(91)-022-66604676,"S2, Unit No 17, Skyzone Phase 2, Senapati Bapat Marg, Lower Parel, Mumbai - 400013, High Street Phoenix","Readymade Garment Retailers, Wrist Watch Dealers, .."
9,Mumbai,readymade-garments,"Marks & Spencer (Infiniti Mall) in Malad West, Mumbai",+(91)-022-40282703,"Shop No 003, Lower Ground Floor, Infiniti Mall, Link Road, Malad West, Mumbai - 400064, Near Goregaon Sports Club","Readymade Garment Retailers, Men Readymade Garment Retailers, .."
0,Mumbai,readymade-garments,"Babli Fashions in Andheri West, Mumbai",+(91)-022-26334499,"Shop No 1,Benzer Building, Second Cross Lane, Andheri West, Mumbai - 400053, Near High Point Veg Restaurant","Readymade Garment Retailers, Children Readymade Garment Retailers, .."
1,Mumbai,readymade-garments,"Jack & Jones in Bandra West, Mumbai",+(91)-022-42492100,"C/O Shoppers Stop, 5th Floor, Link Road, Bandra West, Mumbai - 400050","Readymade Garment Retailers, Men Readymade Garment Retailers, .."
2,Mumbai,readymade-garments,"Chemistry Store in Bandra West, Mumbai",+(91)-022-26406601,"Govindham Building Shop No 210, Waterfield Road, Bandra West, Mumbai - 400050, Next to Bora Bora Resturant","Readymade Garment Retailers, Jacket Retailers, .."
3,Mumbai,readymade-garments,"US Polo Assn in Bandra West, Mumbai",+(91)-22-26059155,"Saffron Building, Ground Floor, Plot No.346/A, Linking Road, Bandra West, Mumbai - 400050, Opposite Only Paratha Restaurant","Readymade Garment Retailers, T Shirt Retailers, .."
4,Mumbai,readymade-garments,"Fascination Garments in Bandra West, Mumbai",+(91)-22-26410660,"241 9 Hill View, Hill Road, Bandra West, Mumbai - 400050, Opposite Mehboob Studio","Readymade Garment Retailers, Men Readymade Garment Retailers, .."
5,Mumbai,readymade-garments,"Pantaloons Chembur K Star in , Mumbai",+(91)-22-25200371,"302, Diamond Garden, Number 5, Basant Garden, Road, Mumbai - 400071",Readymade Garment Retailers
6,Mumbai,readymade-garments,"Kimaya in Bandra West, Mumbai",+(91)-9892010003,"1st Floor, Linking Road, Bandra West, Mumbai - 400050, Opposite National College, Burger King","Jewellery Showrooms, Shoe Dealers, .."
7,Mumbai,readymade-garments,"Pramanik Retail Pvt Ltd in Matunga East, Mumbai",+(91)-22-24105112,"Shop No 360, K N Building, Bhandarkar Road, Matunga East, Mumbai - 400019, Opposite Ashthika Samaj Ram Mandir, Matunga Central Railway Station","Readymade Garment Retailers, Children Readymade Garment Retailers, .."
8,Mumbai,readymade-garments,"Babubhai Jagjivandas in Mulund West, Mumbai",+(91)-22-25902519,"307 A 9819366608, Dr R P Road, Mulund West, Mumbai - 400080, Near Vardhaman Nagar","Readymade Garment Retailers, Dress Material Retailers, .."
9,Mumbai,readymade-garments,"Fabindia in Grant Road, Mumbai",+(91)-8655187555,"Unit No B, 2nd Floor, Le Palazzo Tower, August Kranti Marg, Grant Road, Mumbai - 400007, Off Kemps Corner Bridge, Nana Chowk","Readymade Garment Retailers, Saree Retailers, .."
0,Mumbai,readymade-garments,"Jack & Jones (Palladium Mall) in Lower Parel, Mumbai",+(91)-22-43473303,"2nd Floor, S 13/14, Palladium Mall, Senapati Bapat Marg, Lower Parel, Mumbai - 400013","Readymade Garment Retailers, Men Readymade Garment Retailers, .."
1,Mumbai,readymade-garments,"Massimo Dutti (High Street Phoenix) in Lower Parel, Mumbai",+(91)-22-62370731,"Block No 1, Ground & First Floor, Unit No G 5, High Street Phoenix, S B Marg, Lower Parel, Mumbai - 400013, Beside St Regis Hotel, Palladium Mumbai, Palladium North Sky Zone, Phoenix Mill Compound","Readymade Garment Retailers, Men Readymade Garment Retailers, .."
2,Mumbai,readymade-garments,"Design Touch in Bandra West, Mumbai",+(91)-022-26455827,"Bindiya Co-Operative. Housing Society Ltd, 51,Hill Road, Bandra West, Mumbai - 400050, Opposite Bank Of India and Godrej Natures Basket, Near Bandra Medical","Readymade Garment Retailers, Cosmetic Dealers, .."
3,Mumbai,readymade-garments,"First Choice 1 in Andheri East, Mumbai",+(91)-22-28312070,"Shop No 1& 2, Mahakali Caves Road, Andheri East, Mumbai - 400093, Opposite Monginis Cake Shop, Survey No 5","Readymade Garment Retailers, Children Readymade Garment Retailers, .."
4,Mumbai,readymade-garments,"Babubhai Jagjivandas Garments in Charni Road, Mumbai",+(91)-22-23883057,"Shri Ram Mansion, Charni Road, Mumbai - 400004","Readymade Garment Retailers, Ladies Readymade Garment Retailers, .."
5,Mumbai,readymade-garments,"Peter England (Factory Outlet) in Parel, Mumbai",+(91)-22-65055637,"Shop No 1/2/3, Laxmi Cottage, Dr Ambedkar Road, Parel, Mumbai - 400012, Opposite to Apna Sahakari Bank","Readymade Garment Retailers, Shirt Retailers, .."
6,Mumbai,readymade-garments,"Levis Store in Lower Parel, Mumbai",+(91)-22-66155060,"Phoenix Skyzone, Shop No 21, Senapati Bapat Marg, Lower Parel, Mumbai - 400013, Near Railway Station","Readymade Garment Retailers, Men Readymade Garment Retailers, .."
7,Mumbai,readymade-garments,"Moscow Boutique in Ulhasnagar No 3, Mumbai",+(91)-251-2568686,"Shop No 4, Golden Tower, New Link Road, Ulhasnagar No 3, Thane - 421002, Near Sapna Garden","Readymade Garment Retailers, Men Readymade Garment Retailers, .."
8,Mumbai,readymade-garments,"AND Store (High Street Phoenix) in Lower Parel, Mumbai",+(91)-7045959702,"Shop No B 9, 1st Floor, Skyzone, Level One, High Street Phoenix, Lower Parel, Mumbai - 400013","Readymade Garment Retailers, Women Western Garment Retailers, .."
9,Mumbai,readymade-garments,"A To Z Retail Ltd in Crawford Market, Mumbai",+(91)-22-42122500,"Lal Singh Man Singh Building, 412 Shekh Menon Street, Crawford Market, Mumbai - 400001, Opposite L T Police Station","Readymade Garment Retailers, Carpet Dealers, .."
0,Mumbai,readymade-garments,"Libas in Cumballa Hill, Mumbai",+(91)-22-23525145,"Sukh Shani No 2, Ground Floor, 19, Dr G Desmukh Marg, Peddar Road, Cumballa Hill, Mumbai - 400026, Near Jaslok Hospital","Readymade Garment Retailers, Readymade Garment Manufacturers, .."
1,Mumbai,readymade-garments,"Janta Bazar in Virar West, Mumbai",+(91)-250-2501989,"Agashi Road, Virar West, Palghar - 401303, Near Railway Station","Readymade Garment Retailers, Men Readymade Garment Retailers, .."
2,Mumbai,readymade-garments,"Atlantic Plaza in Dadar West, Mumbai",+(91)-8840733808,"Garage Galli, Dadar West, Mumbai - 400028",Readymade Garment Retailers
3,Mumbai,readymade-garments,"The Raymond Shop in Ulhasnagar No 3, Mumbai",+(91)-251-2707465,"Vasant Vihar Shanti Nagar, Kalyan Ambernath Road, Ulhasnagar No 3, Thane - 421002","Readymade Garment Retailers, Fabric Retailers, .."
4,Mumbai,readymade-garments,"Carron Nx in Kalbadevi, Mumbai",+(91)-22-22057161,"No 342,Nr Swadeshi Market, Kalbadevi Road,Opp Badam Wadi, Kalbadevi, Mumbai - 400002","Readymade Garment Retailers, Ladies Readymade Garment Retailers, .."
5,Mumbai,readymade-garments,"Aby Baby Apparels Pvt Ltd in Andheri West, Mumbai",+(91)-22-26311818,"Shop No 3, Sunny Side Building, Andheri West, Mumbai - 400053, Near Lokhandwala Complex","Readymade Garment Retailers, Baby Cradle Dealers, .."
6,Mumbai,readymade-garments,"Woodland Store in Malad West, Mumbai",+(91)-22-65551296,"Shop No 40 A, Shantinath Shopping Center, S V Road, Malad West, Mumbai - 400064, Near Aditi Hotel, Opposite Kotak Mahindra Bank","Readymade Garment Retailers, T Shirt Retailers, .."
7,Mumbai,readymade-garments,"Check Up in Bandra West, Mumbai",+(91)-22-26451999,"Shop No 9/11, Natasha Shopping Centre 52, Hill Road, Bandra West, Mumbai - 400050, Near Elco Panipuri Centre","Readymade Garment Retailers, T Shirt Manufacturers, .."
8,Mumbai,readymade-garments,"Kings in Bandra West, Mumbai",+(91)-22-26425886,"197, Linking Road Bandra, Bandra West, Mumbai - 400050, Opposite HP Petrol Pump ,Next to Bank Of Baroda","Readymade Garment Retailers, Shirt Retailers, .."
9,Mumbai,readymade-garments,"Fabindia (Viviana Mall) in Thane West, Mumbai",+(91)-022-61701396,"Unit No F-35, Viviana Mall, Pokhran Road No 2, Thane West, Thane - 400610, Subhash Nagar, Next to Jupiter Hospital","Readymade Garment Retailers, Online Websites, .."
0,Mumbai,readymade-garments,"Woodland Store (Inorbit Mall) in Malad West, Mumbai",+(91)-022-28779668,"Inorbit Mall, 1st Floor, Link Road, Malad West, Mumbai - 400064","Readymade Garment Retailers, Bag Dealers, .."
1,Mumbai,readymade-garments,"The Raymond Shop in Lower Parel, Mumbai",+(91)-22-67432496,"Unit No 16 & 17, 1st Floor, Phoenix House, Senapati Bapat Marg, Lower Parel, Mumbai - 400013, High Street Phoenix, Skyzone 1","Readymade Garment Retailers, Jeans Retailers, .."
2,Mumbai,readymade-garments,"Zudio in Virar West, Mumbai",+(91)-7888077749,"Gold Crest Building, Virar West, Palghar - 401303, Opposite Viva College, Near Dmart, Y K Nagar","Readymade Garment Retailers, Ladies Readymade Garment Retailers, .."
3,Mumbai,readymade-garments,"Vardhaman Mens Wear in Kalbadevi, Mumbai",+(91)-22-22437502,"Shop No 259/263, Kalbadevi Road, Kalbadevi, Mumbai - 400002, Opposite Adarsh Hotel and Ramesh Store","Readymade Garment Retailers, Jeans Retailers, .."
4,Mumbai,readymade-garments,"Anokhi in Bandra West, Mumbai",+(91)-22-26408263,"Ground Floor  210  Govind Dham, Waterfield Road, Bandra West, Mumbai - 400050, Near to ICICI Bank","Readymade Garment Retailers, Fabric Retailers, .."
5,Mumbai,readymade-garments,"The Raymond Shop in Ghatkopar East, Mumbai",+(91)-22-25015822,"Kailash Plaza,Shop No 21,, Vallabh Baug Lane, 90ft Road, Ghatkopar East, Mumbai - 400077, Near Audience Cinema","Readymade Garment Retailers, T Shirt Retailers, .."
6,Mumbai,readymade-garments,"Raymond Made To Measure in Bandra West, Mumbai",+(91)-22-26405823,"Shop No 4 & 5, Zainab Villa, 187 Turner Road, Bandra West, Mumbai - 400050, Opposite Moti Mahal Restaurant","Readymade Garment Retailers, Blazer Retailers, .."
7,Mumbai,readymade-garments,"Vero Moda in Santacruz West, Mumbai",+(91)-022-61705706,"Plot No 82/89, Linking Road, Santacruz West, Mumbai - 400052","Readymade Garment Retailers, VERO MODA Garment Accessory Dealers, .."
8,Mumbai,readymade-garments,"Cotton King in Naupada-Thane West, Mumbai",+(91)-22-25300846,"Shop No 1, Parvati Niwas, Ram Maruti Road, Naupada-Thane West, Thane - 400602, Near, Ghantali Mandir","Readymade Garment Retailers, Jeans Retailers, .."
9,Mumbai,readymade-garments,"The Raymond Shop in Mulund West, Mumbai",+(91)-22-25690421,"Plot No:237, J N Road, Mulund West, Mumbai - 400080, Beside Apna Bazar","Readymade Garment Retailers, Men Readymade Garment Retailers, .."
0,Mumbai,readymade-garments,"All The Plus Size Store in Santacruz West, Mumbai",+(91)-22-26613926,"Shop No 3, Fiona Building 176, Juhu Tara Road, Santacruz West, Mumbai - 400054, Near Hotel Ajanta, Opposite HDFC Bank, Opposite Little Italy","Readymade Garment Retailers, Men Readymade Garment Retailers, .."
1,Mumbai,readymade-garments,"United Colors Of Benetton (Infiniti Mall) in Malad West, Mumbai",+(91)-022-49762373,"Shop No 109, 1st Floor,  Infiniti Mall, New Link Road, Malad West, Mumbai - 400064, Near D Mart","Readymade Garment Retailers, Ladies Readymade Garment Retailers, .."
2,Mumbai,readymade-garments,"Bombay Bazar in Andheri West, Mumbai",+(91)-22-26246650,"Shop No 25,Shanti Niwas, J P Road, Andheri West, Mumbai - 400058, Opposite  K B Jewellers","Readymade Garment Retailers, Readymade Garment Manufacturers, .."
3,Mumbai,readymade-garments,"Peter England in Andheri West, Mumbai",+(91)-022-66913241,"Shop No-3, Spenta Mansion Apartment, S. V. Road, Andheri West, Mumbai - 400058, Opposite to BMC Hospital, Near Moti Mahal Hotel","Readymade Garment Retailers, Jeans Retailers, .."
4,Mumbai,readymade-garments,"Pagli in Juhu, Mumbai",+(91)-22-26609551,"30A/2, H M House , Adj Rotary Club, Juhu Tara Road, Santacruz(West), Juhu, Mumbai - 400049, Nr Union Bank","Readymade Garment Retailers, Boutiques, .."
5,Mumbai,readymade-garments,"The Raymond Shop (Inorbit Mall) in Malad West, Mumbai",+(91)-022-49725152,"Shop No F12 and F13, First Floor, Inorbit Mall, Link Road, Malad West, Mumbai - 400064","Readymade Garment Retailers, Jeans Retailers, .."
6,Mumbai,readymade-garments,"Fuel The Fashion Store in Khar West, Mumbai",+(91)-22-26497878,"Plot No B-450, Laxmi Niwas, 14th Road, Khar West, Mumbai - 400052, Off Linking Road, Near Dominos","Readymade Garment Retailers, Boutiques, .."
7,Mumbai,readymade-garments,"The Raymond Shop in Malad West, Mumbai",+(91)-22-28891195,"Malad Shopping Centre, Shop 109/110, S V Road, Malad West, Mumbai - 400064, Opposite Aditi Hotel","Readymade Garment Retailers, Shirt Retailers, .."
8,Mumbai,readymade-garments,"All The Plus Size Store (Viviana Mall) in Thane West, Mumbai",+(91)-022-61701323,"1st Floor, Viviana City Mall, Voltas Compound, Pokhran Road No 2, Thane West, Thane - 400601, Next to Jupiter Hospital","Readymade Garment Retailers, Men Readymade Garment Retailers, .."
9,Mumbai,readymade-garments,"Cotton King in Vile Parle East, Mumbai",+(91)-22-26134344,"Shop No 01, Monarch Castle, Hanuman Road, Vile Parle East, Mumbai - 400057, Near Parle Tilak Vidhalaya","Readymade Garment Retailers, Jeans Retailers, .."
0,Mumbai,readymade-garments,"The Raymond Shop in Santacruz West, Mumbai",+(91)-22-26461857,"Shop No 5/6, Station Road, Santacruz West, Mumbai - 400054, Near Sompuri Market","Readymade Garment Retailers, Men Readymade Garment Retailers, .."
1,Mumbai,readymade-garments,"Marks & Spencer (Phoenix Marketcity Mall) in Kamani-kurla West, Mumbai",+(91)-22-61801665,"Ground Floor & Upper Ground Floor,  Phoenix Marketcity Mall, L B S Marg, Kamani-kurla West, Mumbai - 400070, Opposite Naaz Hotel","Readymade Garment Retailers, Children Readymade Garment Retailers, .."
2,Mumbai,readymade-garments,"Boy London in Juhu, Mumbai",+(91)-22-26132523,"Shop No 1, Mithila Shopping Centre, V M Road, Juhu, Mumbai - 400049, Near Juhu Scheme, Near Options Mall","Readymade Garment Retailers, Women Kurti Wholesalers, .."
3,Mumbai,readymade-garments,"Liberal in Kalyan West, Mumbai",+(91)-251-2209422,"Liberal Building, Kalyan West, Thane - 421301, Old Station Road, Shivaji Chowk","Readymade Garment Retailers, Children Readymade Garment Retailers, .."
4,Mumbai,readymade-garments,"Woodland Store in Naupada-thane West, Mumbai",+(91)-022-49745139,"Shop 8 & 9, Hemendra Complex, Gokhale Road, Naupada-thane West, Thane - 400602, Below Indravati Hall","Readymade Garment Retailers, Bag Dealers, .."
5,Mumbai,readymade-garments,"Pantaloons (Maxus Mall) in Bhayandar West, Mumbai",+(91)-22-28184045,"1st & 2nd Floor, Maxus Mall, Bhayandar West, Thane - 401101, Near Tamba Hospital","Readymade Garment Retailers, Ladies Readymade Garment Retailers, .."
6,Mumbai,readymade-garments,"Levis Store (Infiniti Mall) in Andheri West, Mumbai",+(91)-022-66972265,"Shop No 104, 1st Floor, Infiniti Mall, Link Road, Andheri West, Mumbai - 400053, Opposite Hyundai Showroom","Readymade Garment Retailers, Wrist Watch Dealers, .."
7,Mumbai,readymade-garments,"Lacoste Boutique in Santacruz West, Mumbai",+(91)-22-26057893,"24 Usha Villa, Shop No 3 & 4, Linking Road, Santacruz West, Mumbai - 400054, Opposite Kotak Mahindra Bank","Readymade Garment Retailers, Bag Dealers, .."
8,Mumbai,readymade-garments,"Cotton Cottage in Dadar West, Mumbai",+(91)-022-24227893,"Shop No 2 Padhye Buldg, S. K. Bole Road, Dadar West, Mumbai - 400028, Opposite D Silva School","Readymade Garment Retailers, Men Readymade Garment Retailers, .."
9,Mumbai,readymade-garments,"Being Human (Phoenix Marketcity Mall) in Kurla West, Mumbai",+(91)-022-61801553,"Ug 56/57, Phoenix Market City Mall, Lbs Marg, Kurla West, Mumbai - 400070","Readymade Garment Retailers, Jeans Retailers, .."
0,Mumbai,readymade-garments,"Jade Bridal Store in Pedder Road, Mumbai",+(91)-22-23533635,"01,Ground Floor,Mewar Apartments, Dr G Deshmukh Marg, Pedder Road, Mumbai - 400026","Readymade Garment Retailers, Boutiques, .."
1,Mumbai,readymade-garments,"The Loot Store in Marine Lines, Mumbai",+(91)-22-23225522,"38,Maharshi Karve Road, Marine Lines, Mumbai - 400020, Near Metro Cinema","Readymade Garment Retailers, Shoe Dealers, .."
2,Mumbai,readymade-garments,"Speedy in Borivali West, Mumbai",+(91)-22-28931333,"Shop No- 05 / 06, Chandralok Apartment, L T Road, Borivali West, Mumbai - 400092, Opposite Manubhai Jewellers","Readymade Garment Retailers, Jeans Retailers, .."
3,Mumbai,readymade-garments,"Anokhi in Girgaon Chowpatty, Mumbai",+(91)-22-23685308,"Rasik Niwas, Metro Motors Lane, Dr A R Rangekar Marg, Girgaon Chowpatty, Mumbai - 400007, Off Huges Road","Readymade Garment Retailers, Ladies Readymade Garment Wholesalers, .."
4,Mumbai,readymade-garments,"Trends (Phoenix Marketcity Mall) in Kurla West, Mumbai",+(91)-022-61801372,"Shop No Ug 44, Phoenix Marketcity Mall, L B S Marg, Kurla West, Mumbai - 400070, Atrium No 4, Kamani","Readymade Garment Retailers, Shoe Dealers, .."
5,Mumbai,readymade-garments,"Zodiac in Bandra West, Mumbai",+(91)-22-65917121,"Shop No 3, A N House, 31st Road, Off Linking Road, Bandra West, Mumbai - 400050, Opposite Shoppers Stop","Readymade Garment Retailers, Zodiac Gents Readymade Garment Retailers, .."
